{
  "claim_ledger": "reports/claim_ledger.csv",
  "code": [
    {
      "description": "CPU execution script",
      "path": "scripts/execute_paper_cpu_study.py",
      "sha256": "84623e21be3686d218f4827c6c3b39da83fc8d22bdbf3363295e89f6ef8beac7"
    },
    {
      "description": "Pack verifier",
      "path": "scripts/verify_pack.py",
      "sha256": "3727097ee8b1902406786e85bc895ae07fb15d02ce6a64069307e0503a99773c"
    },
    {
      "description": "PowerShell verification wrapper",
      "path": "scripts/run_pack_checks.ps1",
      "sha256": "8d0216adda34c8606e840d0c381c7e3db647549a7e99a0dfa4158e2ae6fc3301"
    },
    {
      "description": "Shell verification wrapper",
      "path": "scripts/run_pack_checks.sh",
      "sha256": "e4473f7bebff361f4cf77ac4b3d43b27029289d2045764461a19cad7de0455f1"
    },
    {
      "description": "CCR reference implementation",
      "path": "skeleton/ccr_mpc.py",
      "sha256": "6d0699b48fc756e3c828722f8e0652deb64264d71765d4d2b0f1c8dfef966fd1"
    },
    {
      "description": "Experiment matrix runner scaffold",
      "path": "skeleton/run_experiments.py",
      "sha256": "b0d94fbf5d1c62069f97bff7df812daed646db798e7c38912fbc0d01b682d590"
    },
    {
      "description": "Execution configuration",
      "path": "configs/execution_config.json",
      "sha256": "e1c93464bdc5d5c6e5262576c215215d553f2f44b59b6f4c5090b3d787f5406b"
    },
    {
      "description": "Result JSON schema",
      "path": "schemas/result_schema.json",
      "sha256": "d4aa41e5f7de5082087e89abf53bba58db0f7b4389cdcc874060d33c4000e2cb"
    },
    {
      "description": "Claim ledger JSON schema",
      "path": "schemas/claim_ledger_schema.json",
      "sha256": "09e3d722f2291639cc5cbeaf90b75d9e17173e15d6adda33d3ee63c8b7bde353"
    },
    {
      "description": "Artifact manifest JSON schema",
      "path": "schemas/artifact_manifest_schema.json",
      "sha256": "a9139be9b57a79b9180902f37edab90b7d0edac458f51d71e999b6698165a2a4"
    }
  ],
  "completion_message": "ICLR CCR-MPC COMPLETE: bounded theory proofs, counterfactual-risk algorithms, calibration code, CPU experiment suite, baselines, ablations, plots, paper manuscript, related-work audit, and reviewer-defense reports are finished. All claims are backed by generated artifacts. Human review is required before submission.",
  "created_utc": "2026-07-06T13:45:14.196597+00:00",
  "experiments": [
    {
      "description": "Experiment log or flat result table",
      "path": "logs/results.jsonl",
      "sha256": "e2d726dedd358d1b09836fae701058f2065fb68d033305220b70347a519c9e24"
    },
    {
      "description": "Experiment log or flat result table",
      "path": "logs/results_flat.csv",
      "sha256": "c0a0bfba57ab2fa47f9617bb5616f560d8a36a2472629019680416a79d461775"
    },
    {
      "description": "Experiment log or flat result table",
      "path": "logs/step_predictions.csv",
      "sha256": "636f3f4c4acd52472eb460428f6e1a0b600dfd1ae1954669c168e4a7c7ef48ca"
    },
    {
      "description": "Experiment log or flat result table",
      "path": "logs/calibration_samples.csv",
      "sha256": "af6e2e3326010d66bc2c840adf9c8fc327a218725ac47ad0b376129be895b3d1"
    },
    {
      "description": "Generated result table",
      "path": "tables/summary_by_method.csv",
      "sha256": "f115772fe6d81c40167cc1d04aebf82ca901b3850b792e446032926da4150111"
    },
    {
      "description": "Generated result table",
      "path": "tables/summary_by_domain_method.csv",
      "sha256": "7bf82ef9fed68af33ab79f8f4ca7a9bff184f28f3e1b93bb7d6f625eb44b3a9a"
    },
    {
      "description": "Generated result table",
      "path": "tables/summary_by_method_level.csv",
      "sha256": "4d85bad8674af734ff51d42c86910d9ba537e0449438221464e3867b30e16e68"
    },
    {
      "description": "Generated result table",
      "path": "tables/main_results_table_rows.tex",
      "sha256": "30c87330f1d228f67666458f9f968bc8c08776e3a7f5f40abcdd7f59c7d6001d"
    }
  ],
  "git_commit": "not-a-git-repository",
  "known_limitations": [
    "Simplified low-dimensional CPU domains, not high-fidelity robot or hardware experiments.",
    "Theory covers a stylized one-step separation, finite-threshold split calibration, and sampled-set optimality only.",
    "Citation metadata has source notes, but final publisher-exported BibTeX should be checked before submission.",
    "The max-out 57,000-row matrix was not fully executed in this focused run."
  ],
  "paper": [
    {
      "description": "Paper artifact index",
      "path": "paper/CCR_MPC_paper_draft.md",
      "sha256": "b838e5a5f84407556d23706de20b8c50a70748e56376a8e99492b8ff666ff5e9"
    },
    {
      "description": "Full LaTeX manuscript",
      "path": "paper/CCR_MPC_paper.tex",
      "sha256": "5d8e5aab807d270a70d0266c6630f006f888699727988bb8e1b70f02f6c9e975"
    },
    {
      "description": "Compiled manuscript PDF",
      "path": "paper/CCR_MPC_paper.pdf",
      "sha256": "04d34c1897f635c265e372ae722355a390fccc5e3126d9fbe4a9a562634a959c"
    },
    {
      "description": "Verified BibTeX references",
      "path": "paper/references.bib",
      "sha256": "c63e93792d1dae442dbd1914bd8739282c1dac6967c14a1d265f088565e0f64e"
    }
  ],
  "paper_title": "Prediction Uncertainty Is Not Control Risk: Counterfactual Risk Calibration for Learned-Dynamics MPC",
  "plots": [
    {
      "description": "Generated figure",
      "path": "figures/safety_performance_pareto.png",
      "sha256": "16c4ffa97381017c965e0c289cc24cadd473be863f8004f4115fe6da2037cd73"
    },
    {
      "description": "Generated figure",
      "path": "figures/ood_severity_curves.png",
      "sha256": "743ca7463a949e9c91ed9aa24f84b54e33d5275ed35775b22562cb02ea36165c"
    },
    {
      "description": "Generated figure",
      "path": "figures/risk_reliability.png",
      "sha256": "5c08a12d45076868e971878773e3907b3491388b4195356c7e0c2a86e49f7916"
    },
    {
      "description": "Generated figure",
      "path": "figures/prediction_error_vs_control_risk.png",
      "sha256": "17713ae72d7e163c6197eeef9d0bf2d3f0bbfbc23eb5342f5beaed270e1c8927"
    },
    {
      "description": "Generated figure",
      "path": "figures/ccr_ablation_bars.png",
      "sha256": "7205aa195479dac352b7c3c88a2723167c14e483e21cccf63fc22cec43851283"
    },
    {
      "description": "Generated figure",
      "path": "figures/compute_time_by_method.png",
      "sha256": "27c9ef19e4df44113f598fee4fd25afc94053f6adbf98f441d7464362a5b8d26"
    }
  ],
  "reports": [
    {
      "description": "Report: claim_ledger",
      "path": "reports/claim_ledger.csv",
      "sha256": "f267d2a2f4c3d8125aa6086d908096d1c543f86f7523646c9b30426470ae0784"
    },
    {
      "description": "Report: theory_moat_report",
      "path": "reports/theory_moat_report.md",
      "sha256": "b5ececd583f33ac04cab7cab3245c27c7191041d3a088d04e41a6ce8e6ec4cc7"
    },
    {
      "description": "Report: prior_work_distinctions",
      "path": "reports/prior_work_distinctions.md",
      "sha256": "00b7a6397017dcaa374df434511a627116ebeaa0aa6df6f0281471c7f2b0f782"
    },
    {
      "description": "Report: experiment_results_summary",
      "path": "reports/experiment_results_summary.md",
      "sha256": "2252d0ede2eecefaf505ed4507420458d78dea6ab732a617eb14f83e7cdd24a7"
    },
    {
      "description": "Report: calibration_report",
      "path": "reports/calibration_report.md",
      "sha256": "3ce91d0fa8b8d6d49f87164618bb05f7ba9831dbfeb115d7ee43eea43b86efa4"
    },
    {
      "description": "Report: reviewer_attack_closure_report",
      "path": "reports/reviewer_attack_closure_report.md",
      "sha256": "8c26abc3b87aac8fb0950cf72a7e1e30bf78772e22daff50c45a7d8f85bab799"
    },
    {
      "description": "Report: readiness_gate_report",
      "path": "reports/readiness_gate_report.md",
      "sha256": "03206de6ab5b8485ee65f176947f4c4d9b2cce187a2c54105c0cf137aa1350d7"
    },
    {
      "description": "Report: completion_audit_report",
      "path": "reports/completion_audit_report.md",
      "sha256": "e59140b81512cecabaa1efa2f58b0230e5001f8dcb05fdd2eaf943d9122b9ea0"
    },
    {
      "description": "Report: plot_table_manifest",
      "path": "reports/plot_table_manifest.md",
      "sha256": "a3e3f5145cc42890670f95c2e0adce3e84ab227631c1592ad381d3fc041f60a8"
    },
    {
      "description": "Report: citation_verification",
      "path": "reports/citation_verification.md",
      "sha256": "00a0887fd273fc4ea5874d0aa2ff58c76e937183653cccdeb41819c570eef471"
    },
    {
      "description": "Report: completion_report",
      "path": "reports/ICLR_CCR_MPC_COMPLETE.md",
      "sha256": "50323578bc9058f5cd0658d2201082d0b8172f472fcb67877527ff56c7af2d68"
    },
    {
      "description": "Package README and completion gate",
      "path": "README_FIRST.md",
      "sha256": "b2b74802e331b18325cd30170d0f9349b739a214e54f19d7b315715b70bde4f9"
    },
    {
      "description": "CLI agent execution prompt",
      "path": "CLI_AGENT_MASTER_PROMPT.md",
      "sha256": "1a2248501c787d27f2a2662b7fe862830b05f21911f589ddb44db4743a07e66d"
    },
    {
      "description": "Research master plan",
      "path": "COUNTERFACTUAL_CONTROL_RISK_MASTER_PLAN.md",
      "sha256": "a02f6919e0457896ed73c0535ba9a7fccded976ca8deae08a01099b70578f75a"
    },
    {
      "description": "Theory plan",
      "path": "THEORY_MOAT_PLAN.md",
      "sha256": "96822922b010055c7f70139120e35c165fdd7aee40aa2e740058ce015be48a56"
    },
    {
      "description": "Experiment max-out plan",
      "path": "EXPERIMENT_MAXOUT_PLAN.md",
      "sha256": "d936c7f0a4cb39f9ad36c3c7f2d26db573665441b472076d220067b75293df03"
    },
    {
      "description": "Prior-work distinction memo",
      "path": "PRIOR_WORK_DISTINCTION_MEMO.md",